[
  {
    "post_id": "did:plc:w7iwhiu6yn27g3cvy2jzchds:3mjlt2rh4nk22",
    "timestamp": "2026-04-16T06:51:02.503Z",
    "text": "In Vietnam, a group of Israelis were harassed by Irish women for one reason only: they are Jewsi. No questions about their politics. No interest in what they actually believe. Just instant abuse, collective blame, and even chants wishing destruction on Tel Aviv. www.israellycool.com/2026/04/16/r...",
    "author": "did:plc:w7iwhiu6yn27g3cvy2jzchds",
    "source": "bluesky",
    "is_repost": false
  },
  {
    "post_id": "did:plc:mc3qj5sytis7mu3p7hosfie7:3mjlt2senxk24",
    "timestamp": "2026-04-16T06:51:03.470Z",
    "text": "Due to an IT issue, Our Phone line is currently down, Please email customer@edinburghtrams.com if you have any issues. Apologies for the inconvenience. ^NB",
    "author": "did:plc:mc3qj5sytis7mu3p7hosfie7",
    "source": "bluesky",
    "is_repost": false
  },
  {
    "post_id": "did:plc:4qxgglnyonqbnobmkyqd2ifu:3mjlt2wpna22h",
    "timestamp": "2026-04-16T06:51:08.025Z",
    "text": "Der Umgang mit Hamas, Hisbollah und Islamischem Dschihad (uvam etc pp) war doch in der Vergangenheit ganz grundsätzlich, vor allem in der EU und den USA, deutlich zu zahm. Keine Spur von der politischen Härte, mit der gegen RAF, ETA und IRA vorgegangen wurde.",
    "author": "did:plc:4qxgglnyonqbnobmkyqd2ifu",
    "source": "bluesky",
    "is_repost": false
  },
  {
    "post_id": "did:plc:6kndbdnawzpis5y33gpacfop:3mjlt2wh37m2g",
    "timestamp": "2026-04-16T06:51:07.701924+00:00",
    "text": "Sebastian Nagl, Matthias Grabmair: BenGER: A Collaborative Web Platform for End-to-End Benchmarking of German Legal Tasks https://arxiv.org/abs/2604.13583 https://arxiv.org/pdf/2604.13583 https://arxiv.org/html/2604.13583",
    "author": "did:plc:6kndbdnawzpis5y33gpacfop",
    "source": "bluesky",
    "is_repost": false
  },
  {
    "post_id": "did:plc:xoljsevgal74v7mknlg6nrpw:3mjlt2uhtes2y",
    "timestamp": "2026-04-16T06:51:05.672Z",
    "text": "Most likely through Purr, if I had to wager a guess! Thanks for sticking around friend 💙",
    "author": "did:plc:xoljsevgal74v7mknlg6nrpw",
    "source": "bluesky",
    "is_repost": false
  },
  {
    "post_id": "did:plc:o6ggjvnj4ze3mnrpnv5oravg:3mjlt2x5kbe2z",
    "timestamp": "2026-04-16T06:51:06.689646+00:00",
    "text": "Feed: \"Drudge Retort\"\nBy: johnny_hotsauce on Thursday, April 16, 2026",
    "author": "did:plc:o6ggjvnj4ze3mnrpnv5oravg",
    "source": "bluesky",
    "is_repost": false
  },
  {
    "post_id": "did:plc:ndfufin77hov4p2slycw7wkh:3mjlt2wq2pc2o",
    "timestamp": "2026-04-16T06:51:06Z",
    "text": "Faridabad to Nashik: Changing profile of terror modules raises security concern #Faridabad #NashikChanging #socialnewsxyz",
    "author": "did:plc:ndfufin77hov4p2slycw7wkh",
    "source": "bluesky",
    "is_repost": false
  },
  {
    "post_id": "did:plc:dscit7ts5azffzksgql5idlz:3mjlt2xieyg2g",
    "timestamp": "2026-04-16T06:51:08.786644+00:00",
    "text": "Fumikazu Konishi, Yuuki Tsubouchi, Hirofumi Tsuruta: SAKURAONE: An Open Ethernet-Based AI HPC System and Its Observed Workload Dynamics in a Single-Tenant LLM Development Environment https://arxiv.org/abs/2604.13600 https://arxiv.org/pdf/2604.13600 https://arxiv.org/html/2604.13600",
    "author": "did:plc:dscit7ts5azffzksgql5idlz",
    "source": "bluesky",
    "is_repost": false
  },
  {
    "post_id": "did:plc:c4gkag53yau6fgft3dw3gow4:3mjlt2ypysc2d",
    "timestamp": "2026-04-16T06:51:10.134Z",
    "text": "현재 내 장르 콜카도 못 가본자는 친구네 장르의 콜카에서 음식 처리반으로 활동중이다",
    "author": "did:plc:c4gkag53yau6fgft3dw3gow4",
    "source": "bluesky",
    "is_repost": false
  },
  {
    "post_id": "did:plc:mx73q6brgmpqf7otipfyplcq:3mjlt2vljxc2z",
    "timestamp": "2026-04-16T06:51:06.841Z",
    "text": "Me, playing through Shining in the Darkness, mostly relying on gamefaqs maps to make the crawling fairly painless.\n\nAlso me, at work, doesn't touch it for a few hours cuz of various things, comes back to this screen: Fack\n\n(I remembered I had the 'see map' spell, so still all good)",
    "author": "did:plc:mx73q6brgmpqf7otipfyplcq",
    "source": "bluesky",
    "is_repost": false
  },
  {
    "post_id": "did:plc:6kndbdnawzpis5y33gpacfop:3mjlt2xiuc22q",
    "timestamp": "2026-04-16T06:51:08.809043+00:00",
    "text": "Jiashuo Wang, Jiawen Duan, Jian Wang, Kaitao Song, Chunpu Xu, Johnny K. W. Ho, Fenggang Yu, Wenjie Li, Johan F. Hoorn: Foresight Optimization for Strategic Reasoning in Large Language Models https://arxiv.org/abs/2604.13592 https://arxiv.org/pdf/2604.13592 https://arxiv.org/html/2604.13592",
    "author": "did:plc:6kndbdnawzpis5y33gpacfop",
    "source": "bluesky",
    "is_repost": false
  },
  {
    "post_id": "did:plc:voa5jj4mjj2u76o7cp6qanjz:3mjlt2wxpvj23",
    "timestamp": "2026-04-16T02:51:08.047-04:00",
    "text": "Maintenance Custodian Associate - Mckinney, TX Job educativ.net/jobs/job/57137...",
    "author": "did:plc:voa5jj4mjj2u76o7cp6qanjz",
    "source": "bluesky",
    "is_repost": false
  },
  {
    "post_id": "did:plc:traxg4jscmm3n3usqi76dsk2:3mjlt2wnna72h",
    "timestamp": "2026-04-16T06:51:07.914612+00:00",
    "text": "Vladimir Kalu\\v{s}ev, Branko Brklja\\v{c}, Milan Brklja\\v{c}: Multi-Agent Object Detection Framework Based on Raspberry Pi YOLO Detector and Slack-Ollama Natural Language Interface https://arxiv.org/abs/2604.13345 https://arxiv.org/pdf/2604.13345 https://arxiv.org/html/2604.13345",
    "author": "did:plc:traxg4jscmm3n3usqi76dsk2",
    "source": "bluesky",
    "is_repost": false
  },
  {
    "post_id": "did:plc:rx6tatnznisgqjxv5mgcmv22:3mjlt2wpoue2t",
    "timestamp": "2026-04-16T06:51:02.61409200Z",
    "text": "Well, what the hell are you supposed to do when you're kicked out of your own life? When everything you've done was barely your own doing? I can't even get DEATH right.",
    "author": "did:plc:rx6tatnznisgqjxv5mgcmv22",
    "source": "bluesky",
    "is_repost": false
  },
  {
    "post_id": "did:plc:epruhyf7ccwzoigw2dzln4te:3mjlt2y3rdk2f",
    "timestamp": "2026-04-16T06:51:09.471Z",
    "text": "à Tata Kata 🙂",
    "author": "did:plc:epruhyf7ccwzoigw2dzln4te",
    "source": "bluesky",
    "is_repost": false
  },
  {
    "post_id": "did:plc:traxg4jscmm3n3usqi76dsk2:3mjlt2xqds22f",
    "timestamp": "2026-04-16T06:51:09.053232+00:00",
    "text": "Caiwen Jiang, Lei Zeng, Wei Liu: A 3D SAM-Based Progressive Prompting Framework for Multi-Task Segmentation of Radiotherapy-induced Normal Tissue Injuries in Limited-Data Settings https://arxiv.org/abs/2604.13367 https://arxiv.org/pdf/2604.13367 https://arxiv.org/html/2604.13367",
    "author": "did:plc:traxg4jscmm3n3usqi76dsk2",
    "source": "bluesky",
    "is_repost": false
  },
  {
    "post_id": "did:plc:diboxvclyh6cwzuop3iohtpr:3mjlt2xgioc2r",
    "timestamp": "2026-04-16T06:51:08.774Z",
    "text": "블스 즐겁게 하고 있었는데 왜 갑자기 안돼",
    "author": "did:plc:diboxvclyh6cwzuop3iohtpr",
    "source": "bluesky",
    "is_repost": false
  },
  {
    "post_id": "did:plc:k7qoyufcykgz6gpinki5zahb:3mjlt2x2zic2r",
    "timestamp": "2026-04-16T06:51:08.397Z",
    "text": "クッパ城で撮った写真がブレブレになったんですけど、なんか🏎️レースに参加してるっぽくなったので採用",
    "author": "did:plc:k7qoyufcykgz6gpinki5zahb",
    "source": "bluesky",
    "is_repost": false
  },
  {
    "post_id": "did:plc:6pvoyipjsgq5bykdl5jrzqin:3mjlt2srqvs2h",
    "timestamp": "2026-04-16T06:51:03.871Z",
    "text": "Adoption Fee: $100 USD\n\nNSFW Alt: $20 USD Extra\n\nNo holds!\n\nHey, everybody! Another new adopt! We've got an otter! Hope you all like him too! ❤️",
    "author": "did:plc:6pvoyipjsgq5bykdl5jrzqin",
    "source": "bluesky",
    "is_repost": false
  },
  {
    "post_id": "did:plc:6p4xzxc6ctnqm2hq4gfk4xys:3mjlt2vdeac24",
    "timestamp": "2026-04-16T06:51:06.574Z",
    "text": "From the notebook of an Ancient Mesopotamian herbalist\nPor Barbara Böck (ILC-CCHS, CSIC)\nwww.herbalhistory.org/home/from-th...",
    "author": "did:plc:6p4xzxc6ctnqm2hq4gfk4xys",
    "source": "bluesky",
    "is_repost": false
  }
]